{
  "schema_version": "1.3",
  "task_id": "p0-b04",
  "iteration": 2,
  "role": "reviewer",
  "role_version": "1.3.1",
  "model_selection_mode": "runtime-default",
  "requested_model": null,
  "config_sha256": "d6aa7a1beb4a8b2c0f4bf43a250ab24067f86d0d92f1672e84e9d8521981fb50",
  "prompt_sha256": "093c7fe6b6e5bec1421313139bcca02d6d7225ddbf8f17215fcffbdbcccae92d",
  "output_schema_sha256": "592489b3f5c049752bbb67366058884ceae36f71bcb9c499f99773daabd6a0bd",
  "input_sha256": {
    "request.json": "c0db81ad119d25c48521e5975ee177691c7dfaba6b7bbc2a8e5347141ba0018e",
    "source.png": "6b29847d97f00ab25e1e21d660efb0b747aa4c7e7faabb382c1e0875bfb89c1f",
    "rendered_slide.png": "4f3cbd6d01a11817837dc4fa77b39a3d6961a8d2a1ae241730a0eb82d11b03d9",
    "layout.json": "aef7b6bb8ca1ac0fbffa091ba1898fddef8e5eea105a5a5f0aa5703ab279f0d3",
    "qa_report.json": "2a1e58bb1fc61d46f3999393fbdbcf6bdde856808573f0b3e2fbb2144001f8d1",
    "asset_manifest.json": "a7bf89dfc83781e9c058cbb5a733aebffaf4997ef75c4a81409b1f3037f15a0c",
    "visual-review-rubric.md": "9ec564c610f8dfbf418905ad1b92e55443e7c2d71cba2296fa352d343cacb41c",
    "reviewer-response.schema.json": "592489b3f5c049752bbb67366058884ceae36f71bcb9c499f99773daabd6a0bd"
  },
  "parameters": {
    "seed": null,
    "temperature": 0.0,
    "top_p": 1.0
  },
  "call_id": "reviewer-b04-i02",
  "context_id": "/root/reviewer_b04_i02:p0-b04:review:i02",
  "parent_context_id": null,
  "status": "succeeded"
}
