{"schema_version":"1.3","task_id":"p4-live-01","iteration":1,"role":"planner","role_version":"1.5.1","model_selection_mode":"runtime-default","requested_model":null,"config_sha256":"389921f618ee2a9dfb31c23c6c13f2a9789ce37225826e7d764c7d6cfb858f42","prompt_sha256":"dbc039f85f44787594ec5df06032ddc641230b4df00dd925cc08d0de37d94f7e","output_schema_sha256":"fa1b32ba47af6b5977b03062f2474b74f23dc1c1899663e5980781958b02718b","input_sha256":{"request.json":"538c01a0ef22acf52b54e2075e5426fa891531ea7eee6006ad50d36ab7e942fd","source.png":"cc6393c1eea23a8867c00b76e295c87f175105a1db1e185f728e4590efde11b0","reconstruction-handoff.json":"4dcbec2e54da42c29e2c9a10f574f35e930951f62da53b4a1ca5c4bb32f66666","visual-spec.json":"7fc5b6e38ef3838c924fa1aa6a438732e0a090867a8e62b01d945bb62b6e568c","reconstruction-plan.schema.json":"03d4b3a570a00ac85a8b27b82a4d8e37f10a6a79ff66b7dc0cf6d9147d3a2b3e","element-classification.md":"63342bf34f09d6e3ccce0a3c40f5c07dc0798a24ddc522e6a8fe1d91e87fb94d","planner-response.schema.json":"fa1b32ba47af6b5977b03062f2474b74f23dc1c1899663e5980781958b02718b"},"parameters":{"temperature":0.2,"top_p":1.0,"seed":null},"call_id":"p4-live-01","context_id":"codex:/root/fresh_planner_retry","parent_context_id":null,"status":"succeeded"}
