{
  "schema_version": "1.3",
  "task_id": "p0-b04",
  "iteration": 1,
  "role": "planner",
  "role_version": "1.3.0",
  "model_selection_mode": "runtime-default",
  "requested_model": null,
  "config_sha256": "7c743b7d13c8c40925840939aaf16682deb1ef191aad269e782ecd70630decb2",
  "prompt_sha256": "a26692f810e4e017b26993019dd69a37d77cacff95820b8d9c2a3d0d2ae64fe1",
  "output_schema_sha256": "6267525451ce5f1d38b55a4e29d97c87eb490889a2434a7bde83a91d4adefe98",
  "input_sha256": {
    "request.json": "c0db81ad119d25c48521e5975ee177691c7dfaba6b7bbc2a8e5347141ba0018e",
    "source.png": "6b29847d97f00ab25e1e21d660efb0b747aa4c7e7faabb382c1e0875bfb89c1f",
    "layout.schema.json": "64205aac35b6aa3d939cfecc92f76e9cfbebc0fc491df13c3aae0a0ea58a5268",
    "crops.schema.json": "fe36cdcfc5f84b83ac018748ea6cddf16b28acb7e813d0e2c0c22426eee96193",
    "asset-manifest.schema.json": "6a6641e2763cce63d973c5624e1a4a284780daa247e5cf08a18380db97054557",
    "element-classification.md": "63342bf34f09d6e3ccce0a3c40f5c07dc0798a24ddc522e6a8fe1d91e87fb94d",
    "ppt-build-contract.md": "fa258567765d2af345cf8c5e74f508b7cf34bfa860e171c009f82aafc9a26aa0",
    "planner-response.schema.json": "6267525451ce5f1d38b55a4e29d97c87eb490889a2434a7bde83a91d4adefe98"
  },
  "parameters": {
    "seed": null,
    "temperature": 0.2,
    "top_p": 1.0
  },
  "call_id": "planner-b04-i01",
  "context_id": "planner-/root/planner_b03_b04-b04",
  "parent_context_id": null,
  "status": "succeeded"
}
