{"schema_version":"1.3","task_id":"D03","iteration":1,"role":"reviewer","role_version":"1.4.0","model_selection_mode":"runtime-default","requested_model":null,"config_sha256":"8e60554ecc8f7c29c94ae20d914f5664421aa334004e21db9db12f8c5b02332d","prompt_sha256":"7d6e7bbc64c212a7de643e1f3b874fbe86c73e03939ae2d15a1877c682fdc37c","output_schema_sha256":"6ab3d18f5f40b903a5f045faf733478c977187ee76caba8254bb64ebffc6d458","input_sha256":{"approved-preview-contact-sheet.png":"6b9cb29d73cbd641641bd9c4b99653e6c3dae832bb6098ddaaa5b4fd5fe01f30","final-candidate-contact-sheet.png":"deee9b48a061143c9082b135bdc5882af389c2bea2b04f27c35271014cb3a711","approved-vs-final-comparison-sheet.png":"9cf675f0368cde0edf0b2513e5f5dce1a89fbe33d8504c99a47b82581f89884a","deck-visual-system-summary.json":"499b182d1caac45d2a6c1066073b5b2168e40586dfab0a6305d5fdbafc84ad7b","deck-final-qa-report.json":"f915f504ef6c51e9c173e943db7aabf68805d8c1669d3f5ef471e7edfdf2abc7","powerpoint-roundtrip-report.json":"b4bb45ededd16a336a0f118342363d6fd8dd3d03655c94eed4e7c72f55cae13a","p4-fidelity-inheritance.json":"8103e399d34c2ab1b7e2f6f821e91f1c6a7c1972bfe0cb881a1172835f9bb00c","exception-review-hashes.json":"58f66b7aca4e2f865a8f430d849ad62ee182c54165781353f53a31c9f13cfc4d","deck-consistency-reviewer-response.schema.json":"6ab3d18f5f40b903a5f045faf733478c977187ee76caba8254bb64ebffc6d458"},"parameters":{"seed":null,"temperature":0.0,"top_p":1.0},"call_id":"d03-deck-review-r1","context_id":"codex:/root/d03_deck_consistency_r1","parent_context_id":null,"status":"succeeded","resolved_model_identity":{"schema_version":"1.0","artifact_type":"reviewer_model_identity","provider":"openai","model_id":"gpt-5.6-sol","model_version_or_runtime_fingerprint":"codex-agent:/root/d03_deck_consistency_r1","transport_class":"codex_collaboration","endpoint_class":"codex_agent_runtime","parameters":{"seed":null,"temperature":0.0,"top_p":1.0}},"resolved_model_identity_sha256":"d310b7b63bdac4f1caefa3672605ee9b28856568757d46c8bdf717a46b7ec8c0","transport_request_sha256":"edf3e4d22ef96ec47e4979d541c77d173d8dea6192ffb14f8d518cb8ad057acc","prepared_at_utc":"2026-08-20T08:17:05.435Z","invoked_at_utc":"2026-08-20T08:17:05.470Z","completed_at_utc":"2026-08-20T08:20:48.304Z"}
