{
  "schema_version": "1.3",
  "task_id": "p0-b02",
  "iteration": 1,
  "role": "planner",
  "role_version": "1.3.0",
  "model_selection_mode": "runtime-default",
  "requested_model": null,
  "config_sha256": "7c743b7d13c8c40925840939aaf16682deb1ef191aad269e782ecd70630decb2",
  "prompt_sha256": "a26692f810e4e017b26993019dd69a37d77cacff95820b8d9c2a3d0d2ae64fe1",
  "output_schema_sha256": "6267525451ce5f1d38b55a4e29d97c87eb490889a2434a7bde83a91d4adefe98",
  "input_sha256": {
    "request.json": "c960f78e98cdf32dc4c3e6c71ca2b650c2d1197327ed5a91df0e62f12fbd2e8f",
    "source.png": "6389249a048864900312fed74ba7615b810a7950f11a78e73a8e3566547d2937",
    "layout.json": "d6dfa036894376fb4efb61cf28ec514b8e57ddc88e794f84732d6ff380c2ff50",
    "crops.json": "d317df856f515844c7289b0a521323dcf85a8f7b9615fe40f48291a722fc22ab",
    "asset_manifest.json": "28bdcf512b57807abb77b04323c214d5339c7b33a514775a19f51fa103d2be8b",
    "qa_report.json": "08e8fd72d79e32f5cbff29a16533b6b874a01e51080948a5dc883352236080e2",
    "review_report.json": "c47f3211e8c4f589287633064010b11bbc66723a05c82749c06840188d204ecd",
    "review_evaluation.json": "73e1ef32b08f7898aa86f3dc6d572f28f24afd02108460994553e1076969cfec",
    "review-patch.schema.json": "287eb20a3818106cb036f407a99b63e58dc87f7d36673e9302b00d7a059891f6",
    "planner-response.schema.json": "6267525451ce5f1d38b55a4e29d97c87eb490889a2434a7bde83a91d4adefe98"
  },
  "parameters": {
    "temperature": 0.2,
    "top_p": 1.0,
    "seed": null
  },
  "call_id": "planner-b02-r01",
  "context_id": "/root/planner_b02_r01:p0-b02:revision:i01",
  "parent_context_id": null,
  "status": "succeeded"
}
