{
  "schema_version": "1.3",
  "task_id": "p0-b03",
  "iteration": 1,
  "role": "planner",
  "role_version": "1.3.0",
  "model_selection_mode": "runtime-default",
  "requested_model": null,
  "config_sha256": "7c743b7d13c8c40925840939aaf16682deb1ef191aad269e782ecd70630decb2",
  "prompt_sha256": "a26692f810e4e017b26993019dd69a37d77cacff95820b8d9c2a3d0d2ae64fe1",
  "output_schema_sha256": "6267525451ce5f1d38b55a4e29d97c87eb490889a2434a7bde83a91d4adefe98",
  "input_sha256": {
    "request.json": "176c1ddc6f27e6b898be293cbc7b6f96b0d6b39ba53ad021f473778796326c40",
    "source.png": "c9e0e40148f09a90291c19345cbbe8c7eda74154b67aea4f6e8ad4ed237b3518",
    "layout.json": "9f7f7eda79c6e2774a8a4ba4d64d3a6b3ec250043f0ae960e6514ef4237db15b",
    "crops.json": "d1eaece5fbdafe3639430c90edaf0533bf94af36680944fbfd1ef66f4ee58ea7",
    "asset_manifest.json": "916a972a7c69be357b347da33601954989704694096a6e6b811ab6af406e0603",
    "qa_report.json": "0f8099c1015c37e7b87d96a7b0297efb413ed119919d8317d6e552af5db5d5f8",
    "review_report.json": "d7ccde3483f168f2fcdc0ae74b0ec9196c37ce60371cbc2a0752bf26b2b27b51",
    "review_evaluation.json": "e6bb9a2df105a8030a553180c37a79f2d301acad552c53713e769c25c90039fd",
    "review-patch.schema.json": "287eb20a3818106cb036f407a99b63e58dc87f7d36673e9302b00d7a059891f6",
    "planner-response.schema.json": "6267525451ce5f1d38b55a4e29d97c87eb490889a2434a7bde83a91d4adefe98"
  },
  "parameters": {
    "temperature": 0.2,
    "top_p": 1.0,
    "seed": null
  },
  "call_id": "planner-b03-r01",
  "context_id": "/root/planner_b03_r01:p0-b03:revision:i01",
  "parent_context_id": null,
  "status": "succeeded"
}
