{
  "schema_version": "1.3",
  "task_id": "p0-b02",
  "iteration": 2,
  "role": "planner",
  "role_version": "1.3.0",
  "model_selection_mode": "runtime-default",
  "requested_model": null,
  "config_sha256": "7c743b7d13c8c40925840939aaf16682deb1ef191aad269e782ecd70630decb2",
  "prompt_sha256": "a26692f810e4e017b26993019dd69a37d77cacff95820b8d9c2a3d0d2ae64fe1",
  "output_schema_sha256": "6267525451ce5f1d38b55a4e29d97c87eb490889a2434a7bde83a91d4adefe98",
  "input_sha256": {
    "request.json": "c960f78e98cdf32dc4c3e6c71ca2b650c2d1197327ed5a91df0e62f12fbd2e8f",
    "source.png": "6389249a048864900312fed74ba7615b810a7950f11a78e73a8e3566547d2937",
    "layout.json": "d3024eace5cff3e3aebff82a66385ad212851509443947c7bd19a064d0c005ca",
    "crops.json": "d317df856f515844c7289b0a521323dcf85a8f7b9615fe40f48291a722fc22ab",
    "asset_manifest.json": "28bdcf512b57807abb77b04323c214d5339c7b33a514775a19f51fa103d2be8b",
    "qa_report.json": "9876d161003b7ebacabc1a6d4025c0614df344914ff75eb3b36a447d151d8df1",
    "review_report.json": "0ea955b5fd222d4ffb7d644fd70d6c363e233ba7ec2ef683f6ea18c1434f76ad",
    "review_evaluation.json": "2dcb46804919268d38b800d4b431f6920f9f22b0642759245311dfb7d7022c0f",
    "review-patch.schema.json": "287eb20a3818106cb036f407a99b63e58dc87f7d36673e9302b00d7a059891f6",
    "planner-response.schema.json": "6267525451ce5f1d38b55a4e29d97c87eb490889a2434a7bde83a91d4adefe98"
  },
  "parameters": {
    "seed": null,
    "temperature": 0.2,
    "top_p": 1.0
  },
  "call_id": "planner-b02-r02",
  "context_id": "/root/planner_b02_r02:p0-b02:revision:i02",
  "parent_context_id": null,
  "status": "succeeded"
}
