{
  "schema_version": "1.3",
  "task_id": "p0-b04",
  "iteration": 1,
  "role": "planner",
  "role_version": "1.3.0",
  "model_selection_mode": "runtime-default",
  "requested_model": null,
  "config_sha256": "7c743b7d13c8c40925840939aaf16682deb1ef191aad269e782ecd70630decb2",
  "prompt_sha256": "a26692f810e4e017b26993019dd69a37d77cacff95820b8d9c2a3d0d2ae64fe1",
  "output_schema_sha256": "6267525451ce5f1d38b55a4e29d97c87eb490889a2434a7bde83a91d4adefe98",
  "input_sha256": {
    "request.json": "c0db81ad119d25c48521e5975ee177691c7dfaba6b7bbc2a8e5347141ba0018e",
    "source.png": "6b29847d97f00ab25e1e21d660efb0b747aa4c7e7faabb382c1e0875bfb89c1f",
    "layout.json": "6551d3a25d8c70d8dd38bef269ab1be0e5b4b70979d7b33b8aa9c20ed9063673",
    "crops.json": "8bd333db816756df58090cdff9052eaeb572c3317d303a5e2e6fa9de8d8951ff",
    "asset_manifest.json": "a7bf89dfc83781e9c058cbb5a733aebffaf4997ef75c4a81409b1f3037f15a0c",
    "qa_report.json": "4fb5746fb726207b5b9ed0849889c1bc4b84616c61131795c8b9c27432131a13",
    "review_report.json": "5d584e13f6a6fbfd5f1db21762b1e40b1c0b372d11e361f6c3d001a2310ba9b3",
    "review_evaluation.json": "2a1c376b0afe960720fd76ffa31ed3ec4c68cd11977685a48011f825fc9cb229",
    "review-patch.schema.json": "287eb20a3818106cb036f407a99b63e58dc87f7d36673e9302b00d7a059891f6",
    "planner-response.schema.json": "6267525451ce5f1d38b55a4e29d97c87eb490889a2434a7bde83a91d4adefe98"
  },
  "parameters": {
    "seed": null,
    "temperature": 0.2,
    "top_p": 1.0
  },
  "call_id": "planner-b04-r01",
  "context_id": "/root/planner_b04_r01:p0-b04:revision:i01",
  "parent_context_id": null,
  "status": "succeeded"
}
