{
  "schema_version": "1.3",
  "task_id": "p0-b02",
  "iteration": 1,
  "role": "reviewer",
  "role_version": "1.3.1",
  "model_selection_mode": "runtime-default",
  "requested_model": null,
  "config_sha256": "d6aa7a1beb4a8b2c0f4bf43a250ab24067f86d0d92f1672e84e9d8521981fb50",
  "prompt_sha256": "093c7fe6b6e5bec1421313139bcca02d6d7225ddbf8f17215fcffbdbcccae92d",
  "output_schema_sha256": "592489b3f5c049752bbb67366058884ceae36f71bcb9c499f99773daabd6a0bd",
  "input_sha256": {
    "request.json": "c960f78e98cdf32dc4c3e6c71ca2b650c2d1197327ed5a91df0e62f12fbd2e8f",
    "source.png": "6389249a048864900312fed74ba7615b810a7950f11a78e73a8e3566547d2937",
    "rendered_slide.png": "abda1b6bcd3febd7e717cbb507329b4f39b38fe2ba40179ae0def1fc4dfca093",
    "layout.json": "d6dfa036894376fb4efb61cf28ec514b8e57ddc88e794f84732d6ff380c2ff50",
    "qa_report.json": "08e8fd72d79e32f5cbff29a16533b6b874a01e51080948a5dc883352236080e2",
    "asset_manifest.json": "28bdcf512b57807abb77b04323c214d5339c7b33a514775a19f51fa103d2be8b",
    "visual-review-rubric.md": "9ec564c610f8dfbf418905ad1b92e55443e7c2d71cba2296fa352d343cacb41c",
    "reviewer-response.schema.json": "592489b3f5c049752bbb67366058884ceae36f71bcb9c499f99773daabd6a0bd"
  },
  "parameters": {
    "seed": null,
    "temperature": 0.0,
    "top_p": 1.0
  },
  "call_id": "reviewer-b02-i01",
  "context_id": "/root/reviewer_b01_b02/b02/reviewer-b02-i01",
  "parent_context_id": null,
  "status": "succeeded"
}
