{
  "schema_version": "1.3",
  "task_id": "p0-b02",
  "iteration": 2,
  "role": "reviewer",
  "role_version": "1.3.1",
  "model_selection_mode": "runtime-default",
  "requested_model": null,
  "config_sha256": "d6aa7a1beb4a8b2c0f4bf43a250ab24067f86d0d92f1672e84e9d8521981fb50",
  "prompt_sha256": "093c7fe6b6e5bec1421313139bcca02d6d7225ddbf8f17215fcffbdbcccae92d",
  "output_schema_sha256": "592489b3f5c049752bbb67366058884ceae36f71bcb9c499f99773daabd6a0bd",
  "input_sha256": {
    "request.json": "c960f78e98cdf32dc4c3e6c71ca2b650c2d1197327ed5a91df0e62f12fbd2e8f",
    "source.png": "6389249a048864900312fed74ba7615b810a7950f11a78e73a8e3566547d2937",
    "rendered_slide.png": "e610f5fcb8673ba32c244dca435d39fc7d3649f9f36ea71a1c0061e7601fce69",
    "layout.json": "d3024eace5cff3e3aebff82a66385ad212851509443947c7bd19a064d0c005ca",
    "qa_report.json": "9876d161003b7ebacabc1a6d4025c0614df344914ff75eb3b36a447d151d8df1",
    "asset_manifest.json": "28bdcf512b57807abb77b04323c214d5339c7b33a514775a19f51fa103d2be8b",
    "visual-review-rubric.md": "9ec564c610f8dfbf418905ad1b92e55443e7c2d71cba2296fa352d343cacb41c",
    "reviewer-response.schema.json": "592489b3f5c049752bbb67366058884ceae36f71bcb9c499f99773daabd6a0bd"
  },
  "parameters": {
    "temperature": 0.0,
    "top_p": 1.0,
    "seed": null
  },
  "call_id": "reviewer-b02-i02",
  "context_id": "/root/reviewer_b02_i02:p0-b02:review:i02",
  "parent_context_id": null,
  "status": "succeeded"
}
