{
  "schema_version": "1.3",
  "task_id": "p0-b02",
  "iteration": 3,
  "role": "reviewer",
  "role_version": "1.3.1",
  "model_selection_mode": "runtime-default",
  "requested_model": null,
  "config_sha256": "d6aa7a1beb4a8b2c0f4bf43a250ab24067f86d0d92f1672e84e9d8521981fb50",
  "prompt_sha256": "093c7fe6b6e5bec1421313139bcca02d6d7225ddbf8f17215fcffbdbcccae92d",
  "output_schema_sha256": "592489b3f5c049752bbb67366058884ceae36f71bcb9c499f99773daabd6a0bd",
  "input_sha256": {
    "request.json": "c960f78e98cdf32dc4c3e6c71ca2b650c2d1197327ed5a91df0e62f12fbd2e8f",
    "source.png": "6389249a048864900312fed74ba7615b810a7950f11a78e73a8e3566547d2937",
    "rendered_slide.png": "876903888de666997bfeb374b639c7bfaccee620bd293d712a1b6be70d2201cd",
    "layout.json": "8ccdc4d8a165b26201c0fefa4c0ca021812fcb80a9d0340dc65a5ffb61e3bda8",
    "qa_report.json": "f12537c21a71675549d0d370b55b1b68c28e4c1c5a2575f6b6d0aecb8ba1f3ce",
    "asset_manifest.json": "28bdcf512b57807abb77b04323c214d5339c7b33a514775a19f51fa103d2be8b",
    "visual-review-rubric.md": "9ec564c610f8dfbf418905ad1b92e55443e7c2d71cba2296fa352d343cacb41c",
    "reviewer-response.schema.json": "592489b3f5c049752bbb67366058884ceae36f71bcb9c499f99773daabd6a0bd"
  },
  "parameters": {
    "seed": null,
    "temperature": 0.0,
    "top_p": 1.0
  },
  "call_id": "reviewer-b02-i03",
  "context_id": "/root/reviewer_b02_i03:p0-b02:review:i03",
  "parent_context_id": null,
  "status": "succeeded"
}
