{"schema_version":"1.3","task_id":"p5-live-01","iteration":1,"role":"planner","role_version":"1.6.0","model_selection_mode":"runtime-default","requested_model":null,"config_sha256":"f5faa7e64772f8505511d822719335918a00c51d68ca6cd519843532d4d13ede","prompt_sha256":"03463ce21a4d2884971c87706478a7d63452ba1ff2c48d989f21c4a11d2ad382","output_schema_sha256":"0f0bdf0f4a2e335951c2ea191ca155e91e4566e21e17e94d12ae365ad0b7786c","parameters":{"seed":null,"temperature":0.2,"top_p":1.0},"call_id":"p5-live-01","input_sha256":{"request.json":"974340353d3c4b7c3c956407d9a805b3cde9a638e31645315b279dddb97df3c9","source.png":"a3eec18676a463efe919f101d47263068450c6d0fff480c73dd4555b77d95591","reconstruction-handoff.json":"6defa807ce91ba06ebd833665e80c5137199fa9f135d09cf84ce6d10416c00a4","visual-spec.json":"e405211634925186a9e569d06a55c1dbed38a710202992013fc311923d52175e","reconstruction-plan.json":"0bd301216eed32da245b32b57b45a7af186e5edf739ba8036fe10d392754fcd7","qa_report.json":"103c11cf980fd1ac8dc02c676daa2e2940ab8fe9c315559baa1c193d83df35d6","review_report.json":"ee916ff4d9a98ba89962fd5d36d60797b0e0e60f31380acfeb5a03c77c1254e6","review_evaluation.json":"4c664e7d72089057dfbdb5f5574aa3dc0883dc1309976fc3152724f94ff790b0","revision-patch.schema.json":"e6e421b7591e28ffc8824f2be6b23a220b7128a4bc4a0e08639ae5076dbf25fb","planner-response.schema.json":"0f0bdf0f4a2e335951c2ea191ca155e91e4566e21e17e94d12ae365ad0b7786c"},"context_id":"codex:/root/p5_fresh_planner","parent_context_id":null,"status":"succeeded"}
