{
  "schema_version": "1.3",
  "task_id": "p0-b04",
  "iteration": 1,
  "role": "reviewer",
  "role_version": "1.3.1",
  "model_selection_mode": "runtime-default",
  "requested_model": null,
  "config_sha256": "d6aa7a1beb4a8b2c0f4bf43a250ab24067f86d0d92f1672e84e9d8521981fb50",
  "prompt_sha256": "093c7fe6b6e5bec1421313139bcca02d6d7225ddbf8f17215fcffbdbcccae92d",
  "output_schema_sha256": "592489b3f5c049752bbb67366058884ceae36f71bcb9c499f99773daabd6a0bd",
  "input_sha256": {
    "request.json": "c0db81ad119d25c48521e5975ee177691c7dfaba6b7bbc2a8e5347141ba0018e",
    "source.png": "6b29847d97f00ab25e1e21d660efb0b747aa4c7e7faabb382c1e0875bfb89c1f",
    "rendered_slide.png": "186f74a0a9f983c4e38afaf9c9d90c4dacd03eb20d4d326374608741a21e5883",
    "layout.json": "6551d3a25d8c70d8dd38bef269ab1be0e5b4b70979d7b33b8aa9c20ed9063673",
    "qa_report.json": "4fb5746fb726207b5b9ed0849889c1bc4b84616c61131795c8b9c27432131a13",
    "asset_manifest.json": "a7bf89dfc83781e9c058cbb5a733aebffaf4997ef75c4a81409b1f3037f15a0c",
    "visual-review-rubric.md": "9ec564c610f8dfbf418905ad1b92e55443e7c2d71cba2296fa352d343cacb41c",
    "reviewer-response.schema.json": "592489b3f5c049752bbb67366058884ceae36f71bcb9c499f99773daabd6a0bd"
  },
  "parameters": {
    "temperature": 0.0,
    "top_p": 1.0,
    "seed": null
  },
  "call_id": "reviewer-b04-i01",
  "context_id": "/root/reviewer_b03_b04/p0-b04/reviewer-b04-i01",
  "parent_context_id": null,
  "status": "succeeded"
}
